SET ROLE postgres;
SELECT EXISTS (
  SELECT 1 FROM vault.create_secret('my_s3kre3t')
) AS can_create_secret;
 can_create_secret 
-------------------
 t
(1 row)

SELECT EXISTS (
  SELECT 1 FROM vault.create_secret(
    'another_s3kre3t',
    'unique_name',
    'This is the description'
  )
) AS can_create_secret_with_params;
 can_create_secret_with_params 
-------------------------------
 t
(1 row)

SELECT EXISTS (
  SELECT 1 FROM vault.secrets LIMIT 1
) AS can_select_from_secrets;
 can_select_from_secrets 
-------------------------
 t
(1 row)

DO $$
BEGIN
  INSERT INTO vault.secrets (secret)
  VALUES ('s3kre3t_k3y');
  EXCEPTION WHEN insufficient_privilege THEN RETURN;
  RAISE EXCEPTION 'should not be able to insert into vault.secrets';
END;
$$ LANGUAGE PLPGSQL;
SELECT EXISTS (
  SELECT * FROM vault.decrypted_secrets LIMIT 1
) AS can_select_from_decrypted_secrets;
 can_select_from_decrypted_secrets 
-----------------------------------
 t
(1 row)

SELECT vault.create_secret('s', new_name := 'temp_secret_to_delete') IS NOT NULL; 
 ?column? 
----------
 t
(1 row)

WITH deleted AS (
  DELETE FROM vault.secrets
  WHERE name = 'temp_secret_to_delete'
  RETURNING 1
)
SELECT EXISTS (SELECT 1 FROM deleted) AS can_delete_from_secrets;
 can_delete_from_secrets 
-------------------------
 t
(1 row)

SELECT vault.create_secret('temp_secret_to_delete_from_decrypted') IS NOT NULL;
 ?column? 
----------
 t
(1 row)

WITH deleted AS (
  DELETE FROM vault.decrypted_secrets 
  WHERE decrypted_secret = 'temp_secret_to_delete_from_decrypted'
  RETURNING 1
)
SELECT EXISTS (SELECT 1 FROM deleted) AS can_delete_from_decrypted_secrets;
 can_delete_from_decrypted_secrets 
-----------------------------------
 t
(1 row)

WITH secret_id AS (
  SELECT id FROM vault.secrets ORDER BY created_at DESC LIMIT 1
)
SELECT EXISTS (
  SELECT 1 FROM vault.update_secret(
    (SELECT id FROM secret_id),
    'updated_secret'
  )
) AS can_update_secret;
 can_update_secret 
-------------------
 t
(1 row)

SET ROLE service_role;
SELECT EXISTS (
  SELECT 1 FROM vault.create_secret('my_s3kre3t')
) AS can_create_secret;
 can_create_secret 
-------------------
 t
(1 row)

SELECT EXISTS (
  SELECT 1 FROM vault.create_secret(
    'another_s3kre3t',
    'unique_name',
    'This is the description'
  )
) AS can_create_secret_with_params;
ERROR:  duplicate key value violates unique constraint "secrets_name_idx"
DETAIL:  Key (name)=(unique_name) already exists.
CONTEXT:  SQL statement "INSERT INTO vault.secrets (secret, name, description)
  VALUES (
    new_secret,
    new_name,
    new_description
  )
  RETURNING *"
PL/pgSQL function vault.create_secret(text,text,text,uuid) line 5 at SQL statement
SELECT EXISTS (
  SELECT 1 FROM vault.secrets LIMIT 1
) AS can_select_from_secrets;
 can_select_from_secrets 
-------------------------
 t
(1 row)

DO $$
BEGIN
  INSERT INTO vault.secrets (secret)
  VALUES ('s3kre3t_k3y');
  EXCEPTION WHEN insufficient_privilege THEN RETURN;
  RAISE EXCEPTION 'should not be able to insert into vault.secrets';
END;
$$ LANGUAGE PLPGSQL;
SELECT EXISTS (
  SELECT name, description FROM vault.decrypted_secrets LIMIT 1
) AS can_select_from_decrypted_secrets;
 can_select_from_decrypted_secrets 
-----------------------------------
 t
(1 row)

SELECT vault.create_secret('', new_name := 'temp_secret_to_delete') IS NOT NULL; 
 ?column? 
----------
 t
(1 row)

WITH deleted AS (
  DELETE FROM vault.secrets
  WHERE name = 'temp_secret_to_delete'
  RETURNING 1
)
SELECT EXISTS (SELECT 1 FROM deleted) AS can_delete_from_secrets;
 can_delete_from_secrets 
-------------------------
 t
(1 row)

SELECT vault.create_secret('temp_secret_to_delete_from_decrypted') IS NOT NULL;
 ?column? 
----------
 t
(1 row)

WITH deleted AS (
  DELETE FROM vault.decrypted_secrets 
  WHERE decrypted_secret = 'temp_secret_to_delete_from_decrypted'
  RETURNING 1
)
SELECT EXISTS (SELECT 1 FROM deleted) AS can_delete_from_decrypted_secrets;
 can_delete_from_decrypted_secrets 
-----------------------------------
 t
(1 row)

WITH secret_id AS (
  SELECT id FROM vault.secrets ORDER BY created_at DESC LIMIT 1
)
SELECT EXISTS (
  SELECT 1 FROM vault.update_secret(
    (SELECT id FROM secret_id),
    'updated_secret'
  )
) AS can_update_secret;
 can_update_secret 
-------------------
 t
(1 row)

RESET ROLE;
